H6622,Local CCP,HUMANA WISCONSINHEALTH ORGANIZATION INSURANCE CORP,Humana WisconsinHealth Organization Insurance Corp,Humana Inc.,Not enough data available,5,Not enough data available,5,5,5,Plan too new to be measured,Plan too new to be measured,Plan too new to be measured,5,Plan not required to report measure,Plan not required to report measure,Plan not required to report measure,Not enough data available,4,5,3,5,5,Not enough data available,Plan too new to be measured,Plan too new to be measured,4,5,5,3,5,4,5,3,4,5,Not enough data available,5,Not enough data available,5,5
H6642,Local CCP,"UNIVERSAL HMO OF TEXAS, INC.","Universal HMO of Texas, Inc.","Universal Health Care Group, Inc.",2,1,Not enough data available,5,2,2,Plan too new to be measured,Plan too new to be measured,2,1,1,1,1,Not enough data available,2,4,1,1,1,Not enough data available,1,2,3,2,1,3,2,1,2,1,1,1,Not enough data available,4,Not enough data available,3,1
H6705,Local CCP,"UNIVERSAL HEALTH CARE OF NEVADA, INC.","Universal Health Care of Nevada, Inc.","Universal Health Care Group, Inc.",Plan too small to be measured,Plan not required to report measure,Plan not required to report measure,Plan not required to report measure,Plan not required to report measure,Plan too small to be measured,Plan too new to be measured,Plan too new to be measured,Plan too new to be measured,Plan too small to be measured,Plan too new to be measured,Plan too new to be measured,Plan too new to be measured,Plan too small to be measured,Plan too small to be measured,Plan too small to be measured,Plan too small to be measured,Plan too small to be measured,Plan too small to be measured,Plan too small to be measured,Plan too new to be measured,Plan too new to be measured,Plan too small to be measured,Plan too small to be measured,Plan too small to be measured,Plan too small to be measured,Plan too small to be measured,Plan too small to be measured,Plan too small to be measured,Not enough data available,1,Not enough data available,Not enough data available,Not enough data available,Not enough data available,3,Not enough data available
H6743,Local CCP,ATRIO HEALTH PLANS,ATRIO Health Plans,ATRIO Health Plans,Not enough data available,Not enough data available,Not enough data available,3,Not enough data available,4,Plan too new to be measured,Plan too new to be measured,Plan too new to be measured,Not enough data available,Plan not required to report measure,Plan not required to report measure,Plan not required to report measure,Not enough data available,4,3,3,3,3,4,Plan too new to be measured,Plan too new to be measured,5,4,4,5,4,2,3,5,4,4,Not enough data available,Not enough data available,Not enough data available,4,5
H6786,Local CCP,"ANTHEM HEALTH PLANS OF MAINE, INC.",Anthem Blue Cross and Blue Shield,"WellPoint, Inc.",Plan too new to be measured,Plan too new to be measured,Plan too new to be measured,Plan too new to be measured,Plan too new to be measured,Plan too new to be measured,Plan too new to be measured,Plan too new to be measured,Plan too new to be measured,Plan too new to be measured,Plan not required to report measure,Plan not required to report measure,Plan not required to report measure,Plan too new to be measured,Plan too new to be measured,Plan too new to be measured,Plan too new to be measured,Plan too new to be measured,Plan too new to be measured,Plan too new to be measured,Plan too new to be measured,Plan too new to be measured,Plan too new to be measured,Plan too new to be measured,Plan too new to be measured,Plan too new to be measured,Plan too new to be measured,Plan too new to be measured,Plan too new to be measured,Plan too new to be measured,Plan too new to be measured,Plan too new to be measured,Plan too new to be measured,Plan too new to be measured,Plan too new to be measured,Plan too new to be measured,Plan too new to be measured
H6801,Local CCP,"AHS - TULSA OKLAHOMA HEALTH PLAN, INC",Lovelace Medicare Plan,Ardent Health Services.,Plan too new to be measured,Plan too new to be measured,Plan too new to be measured,Plan too new to be measured,Plan too new to be measured,Plan too new to be measured,Plan too new to be measured,Plan too new to be measured,Plan too new to be measured,Plan too new to be measured,Plan not required to report measure,Plan not required to report measure,Plan not required to report measure,Plan too new to be measured,Plan too new to be measured,Plan too new to be measured,Plan too new to be measured,Plan too new to be measured,Plan too new to be measured,Plan too new to be measured,Plan too new to be measured,Plan too new to be measured,Plan too new to be measured,Plan too new to be measured,Plan too new to be measured,Plan too new to be measured,Plan too new to be measured,Plan too new to be measured,Plan too new to be measured,Not enough data available,Not enough data available,Plan too new to be measured,Not enough data available,Not enough data available,Plan too new to be measured,3,5
H6815,Local CCP,HEALTH NET HEALTH PLAN OF OREGON,"Health Net Health Plan of Oregon, Inc.","Health Net, Inc.",Plan too small to be measured,Plan not required to report measure,Plan not required to report measure,Plan not required to report measure,Plan not required to report measure,Plan too small to be measured,Plan too new to be measured,Plan too new to be measured,Plan too new to be measured,Plan too small to be measured,Plan too new to be measured,Plan too new to be measured,Plan too new to be measured,Plan too small to be measured,Plan too small to be measured,Plan too small to be measured,Plan too small to be measured,Plan too small to be measured,Plan too small to be measured,Plan too small to be measured,Plan too new to be measured,Plan too new to be measured,Plan too small to be measured,Plan too small to be measured,Plan too small to be measured,Plan too small to be measured,Plan too small to be measured,Plan too small to be measured,Plan too small to be measured,Not enough data available,5,Not enough data available,Not enough data available,Not enough data available,Not enough data available,3,Not enough data available
H6864,Local CCP,"GUILDNET, INC.",GuildNet,Jewish Guild for the Blind,Plan too small to be measured,Plan too small to be measured,Plan too small to be measured,Plan too small to be measured,Plan too small to be measured,Plan too small to be measured,Plan too small to be measured,Plan too small to be measured,Plan too small to be measured,Plan too small to be measured,5,5,2,Plan too small to be measured,Plan too small to be measured,Plan too small to be measured,Plan too small to be measured,Plan too small to be measured,Plan too small to be measured,Plan too small to be measured,Plan too small to be measured,Plan too small to be measured,Plan too small to be measured,Plan too small to be measured,Plan too small to be measured,Plan too small to be measured,Plan too small to be measured,Plan too small to be measured,Plan too small to be measured,Not enough data available,5,Not enough data available,Not enough data available,Not enough data available,Not enough data available,2,Not enough data available
H6881,Local CCP,"AMERICA'S 1ST CHOICE INSURANCE COMPANY OF NC, INC.",America's 1st Choice Insurance Company of NC,"America's 1st Choice Holdings of N.C., LLC",Plan too small to be measured,Plan not required to report measure,Plan not required to report measure,Plan not required to report measure,Plan not required to report measure,Plan too small to be measured,Plan too new to be measured,Plan too new to be measured,Plan too new to be measured,Plan too small to be measured,Plan not required to report measure,Plan not required to report measure,Plan not required to report measure,Plan too small to be measured,Plan too small to be measured,Plan too small to be measured,Plan too small to be measured,Plan too small to be measured,Plan too small to be measured,Plan too small to be measured,Plan too new to be measured,Plan too new to be measured,Plan too small to be measured,Plan too small to be measured,Plan too small to be measured,Plan too small to be measured,Plan too small to be measured,Plan too small to be measured,Plan too small to be measured,Not enough data available,5,Not enough data available,Not enough data available,Not enough data available,Not enough data available,5,Not enough data available
H6900,Local CCP,HUMANA INSURANCE COMPANY,Humana Insurance Company,Humana Inc.,3,4,5,3,3,3,Plan too new to be measured,Plan too new to be measured,1,4,Plan not required to report measure,Plan not required to report measure,Plan not required to report measure,2,3,4,2,3,3,4,1,3,3,2,4,1,4,1,3,1,4,2,5,5,Not enough data available,5,5
H6923,Local CCP,"AETNA HEALTH, INC. (PA)",Aetna Medicare,Aetna Inc.,Plan too small to be measured,No data available,No data available,No data available,No data available,Plan too small to be measured,Plan too new to be measured,Plan too new to be measured,2,Plan too small to be measured,Plan not required to report measure,Plan not required to report measure,Plan not required to report measure,Plan too small to be measured,Plan too small to be measured,Plan too small to be measured,Plan too small to be measured,Plan too small to be measured,Plan too small to be measured,Plan too small to be measured,3,2,Plan too small to be measured,Plan too small to be measured,Plan too small to be measured,Plan too small to be measured,Plan too small to be measured,Plan too small to be measured,Plan too small to be measured,1,2,1,Not enough data available,Not enough data available,Not enough data available,5,Not enough data available
H6952,Local CCP,"UNITEDHEALTHCARE COMMUNITY PLAN, INC",UnitedHealthcare Community Plan,"UnitedHealth Group, Inc.",2,2,3,3,2,1,Plan too small to be measured,Plan too small to be measured,2,4,2,2,3,Not enough data available,4,4,2,2,3,2,Not enough data available,Not enough data available,4,4,2,1,4,4,2,2,1,2,5,1,2,5,Not enough data available
H6972,Local CCP,"ARKANSAS COMMUNITY CARE, INC.",Arkansas Community Care/ Texarkana Community Care,Humana Inc.,Plan too new to be measured,Plan too new to be measured,Plan too new to be measured,Plan too new to be measured,Plan too new to be measured,Plan too new to be measured,Plan too new to be measured,Plan too new to be measured,Plan too new to be measured,Plan too new to be measured,Plan not required to report measure,Plan not required to report measure,Plan not required to report measure,Plan too new to be measured,Plan too new to be measured,Plan too new to be measured,Plan too new to be measured,Plan too new to be measured,Plan too new to be measured,Plan too new to be measured,Plan too new to be measured,Plan too new to be measured,Plan too new to be measured,Plan too new to be measured,Plan too new to be measured,Plan too new to be measured,Plan too new to be measured,Plan too new to be measured,Plan too new to be measured,Plan too new to be measured,Plan too new to be measured,Plan too new to be measured,Plan too new to be measured,Plan too new to be measured,Plan too new to be measured,Plan too new to be measured,Plan too new to be measured
H7002,Local CCP,HUMANA INSURANCE COMPANY,Humana Insurance Company,Humana Inc.,3,2,5,4,3,2,Plan too new to be measured,Plan too new to be measured,1,3,Plan not required to report measure,Plan not required to report measure,Plan not required to report measure,Not enough data available,2,4,2,2,3,3,2,1,3,4,2,4,4,4,4,3,4,3,4,Not enough data available,Not enough data available,5,4
H7006,Local CCP,ATRIO HEALTH PLANS,ATRIO Health Plans,ATRIO Health Plans,5,3,5,5,5,4,Plan too new to be measured,Plan too new to be measured,2,5,Plan not required to report measure,Plan not required to report measure,Plan not required to report measure,Not enough data available,4,5,2,2,3,Not enough data available,3,2,4,5,5,5,4,5,3,5,4,5,Not enough data available,Not enough data available,Not enough data available,5,5
H7015,Local CCP,"HEALTHFIRST HEALTH PLAN OF NEW JERSEY, INC.",Healthfirst NJ Medicare Plan,"HF Management Services, LLC",3,2,4,4,3,2,4,1,2,2,2,1,1,Not enough data available,3,4,2,1,2,3,Not enough data available,4,3,2,1,3,2,2,3,3,5,1,2,3,2,3,5
H7086,Local CCP,COMMUNITY HEALTH GROUP,Community Health Group,Community Health Group,Plan too small to be measured,Plan too small to be measured,Plan too small to be measured,Plan too small to be measured,Plan too small to be measured,3,Plan too small to be measured,Plan too small to be measured,5,Plan too small to be measured,4,4,5,Plan too small to be measured,Plan too small to be measured,Plan too small to be measured,Plan too small to be measured,Plan too small to be measured,Plan too small to be measured,Plan too small to be measured,Not enough data available,4,Plan too small to be measured,Plan too small to be measured,1,3,2,1,2,4,5,2,Not enough data available,Not enough data available,Not enough data available,3,Not enough data available
H7149,Local CCP,"COVENTRY HEALTH CARE OF NEBRASKA, INC.",Coventry Health Care,Coventry Health Care Inc.,3,3,3,3,2,4,5,3,2,3,Plan not required to report measure,Plan not required to report measure,Plan not required to report measure,3,3,4,4,4,4,Not enough data available,1,3,3,5,5,4,4,2,4,2,2,3,4,Not enough data available,Not enough data available,4,5
H7173,Local CCP,"PEACH STATE HEALTH PLAN, INC.",Advantage by Peach State,Centene Corporation,Plan too small to be measured,Plan not required to report measure,Plan not required to report measure,Plan not required to report measure,Plan not required to report measure,Plan too small to be measured,Plan too new to be measured,Plan too new to be measured,Plan too new to be measured,Plan too small to be measured,Plan too new to be measured,Plan too new to be measured,Plan too new to be measured,Plan too small to be measured,Plan too small to be measured,Plan too small to be measured,Plan too small to be measured,Plan too small to be measured,Plan too small to be measured,Plan too small to be measured,Plan too new to be measured,Plan too new to be measured,Plan too small to be measured,Plan too small to be measured,Plan too small to be measured,Plan too small to be measured,Plan too small to be measured,Plan too small to be measured,Plan too small to be measured,Not enough data available,5,Not enough data available,Not enough data available,Not enough data available,Not enough data available,3,Not enough data available
H7187,Local CCP,UNITEDHEALTHCARE INSURANCE COMPANY,UnitedHealthcare,"UnitedHealth Group, Inc.",3,2,3,4,2,2,5,2,2,3,Plan not required to report measure,Plan not required to report measure,Plan not required to report measure,1,2,4,3,2,3,4,2,3,4,4,4,2,4,2,4,3,1,3,4,3,4,5,5
H7188,Local CCP,HUMANA INSURANCE COMPANY,Humana Insurance Company,Humana Inc.,2,2,3,3,3,2,5,2,1,3,Plan not required to report measure,Plan not required to report measure,Plan not required to report measure,1,2,3,2,2,3,5,2,1,3,4,4,1,4,4,3,2,4,1,4,5,Not enough data available,5,5
H7200,Local CCP,"AMERIGROUP TENNESSEE, INC.",Amerigroup Community Care,AMERIGROUP Corporation,2,2,4,4,1,2,Not enough data available,Not enough data available,1,4,3,4,4,Not enough data available,4,5,3,3,3,Not enough data available,Not enough data available,Not enough data available,3,3,2,2,1,4,2,1,4,3,5,1,Not enough data available,3,5
H7220,Local CCP,"INDIANA UNIVERSITY HEALTH PLANS, INC.",Indiana University Health Plans - Medicare,Indiana University Health,4,5,5,4,4,5,Plan too new to be measured,Plan too new to be measured,2,5,Plan not required to report measure,Plan not required to report measure,Plan not required to report measure,1,4,5,4,5,5,5,1,3,3,5,5,5,5,5,5,4,4,5,2,Not enough data available,Not enough data available,5,5
H7281,Local CCP,"BRAVO HEALTH PENNSYLVANIA, INC.",Bravo Health,CIGNA,2,2,3,4,3,3,Plan too new to be measured,Plan too new to be measured,2,2,2,2,2,Not enough data available,2,4,2,2,2,Not enough data available,2,3,2,1,2,2,2,1,2,1,4,3,1,Not enough data available,Not enough data available,5,5
H7292,Local CCP,ALAMEDA ALLIANCE JOINT POWERS AUTHORITY (JPA),Alameda Alliance for Health,Alameda Alliance for Health,3,4,4,3,2,3,5,2,5,3,3,3,2,Not enough data available,3,4,2,2,3,4,3,5,4,2,1,1,2,2,2,4,4,5,5,4,Not enough data available,3,Not enough data available
H7301,Local CCP,"COVENTRY HEALTH CARE OF ILLINOIS, INC.","Coventry Health Care of Illinois, Inc.",Coventry Health Care Inc.,3,5,5,5,2,2,Plan too small to be measured,Plan too small to be measured,1,5,Plan not required to report measure,Plan not required to report measure,Plan not required to report measure,2,4,5,5,5,5,4,1,2,3,4,5,4,4,4,4,5,2,4,5,5,2,4,5
H7306,Local CCP,FIRST HEALTH LIFE & HEALTH INSURANCE COMPANY,Coventry Health Care,Coventry Health Care Inc.,2,5,5,5,1,2,Plan too new to be measured,Plan too new to be measured,2,4,Plan not required to report measure,Plan not required to report measure,Plan not required to report measure,Not enough data available,4,5,5,5,5,3,2,1,4,1,2,4,4,2,3,1,2,1,5,Not enough data available,Not enough data available,4,5
H7352,Local CCP,"UNIVERSITY CARE ADVANTAGE, L.L.C",University Care Advantage,"UA Healthcare, Inc.",3,3,3,4,3,1,5,2,2,5,4,3,4,Not enough data available,4,5,3,3,4,2,Not enough data available,4,2,2,3,1,2,3,2,3,4,2,4,3,2,3,Not enough data available
H7475,Local CCP,"CARE WISCONSIN HEALTH PLAN, INC.","Care Wisconsin Health Plan, Inc.","Care Wisconsin First, Inc.",Plan too small to be measured,Plan too small to be measured,Plan too small to be measured,Plan too small to be measured,Plan too small to be measured,Plan too small to be measured,Plan too small to be measured,Plan too small to be measured,Plan too small to be measured,Plan too small to be measured,5,5,5,Plan too small to be measured,Plan too small to be measured,Plan too small to be measured,Plan too small to be measured,Plan too small to be measured,Plan too small to be measured,Plan too small to be measured,Plan too small to be measured,Plan too small to be measured,Plan too small to be measured,Plan too small to be measured,Plan too small to be measured,Plan too small to be measured,Plan too small to be measured,Plan too small to be measured,Plan too small to be measured,Not enough data available,5,Not enough data available,Not enough data available,Not enough data available,Not enough data available,3,Not enough data available
H7526,Local CCP,MEDICA HEALTH PLANS,Medica Health Plans,Medica Holding Company,Plan too small to be measured,Plan too small to be measured,Plan too small to be measured,Plan too small to be measured,Plan too small to be measured,Plan too small to be measured,Plan too small to be measured,Plan too small to be measured,Plan too small to be measured,Plan too small to be measured,5,3,4,Plan too small to be measured,Plan too small to be measured,Plan too small to be measured,Plan too small to be measured,Plan too small to be measured,Plan too small to be measured,Plan too small to be measured,Plan too small to be measured,Plan too small to be measured,Plan too small to be measured,Plan too small to be measured,Plan too small to be measured,Plan too small to be measured,Plan too small to be measured,Plan too small to be measured,Plan too small to be measured,Not enough data available,4,Not enough data available,Not enough data available,Not enough data available,Not enough data available,3,Not enough data available
H7678,Local CCP,"MOLINA HEALTHCARE OF TEXAS, INC.","Molina Healthcare of Texas, Inc.","Molina Healthcare, Inc.,",Plan too small to be measured,Plan too small to be measured,Plan too small to be measured,Plan too small to be measured,Plan too small to be measured,Plan too small to be measured,Plan too small to be measured,Plan too small to be measured,Not enough data available,Plan too small to be measured,2,2,3,Plan too small to be measured,Plan too small to be measured,Plan too small to be measured,Plan too small to be measured,Plan too small to be measured,Plan too small to be measured,Plan too small to be measured,Not enough data available,Not enough data available,Plan too small to be measured,Plan too small to be measured,Plan too small to be measured,Plan too small to be measured,Plan too small to be measured,Plan too small to be measured,Plan too small to be measured,Not enough data available,5,Not enough data available,Not enough data available,Not enough data available,Not enough data available,4,5
H7728,Local CCP,"ANTHEM HEALTH PLANS OF NEW HAMPSHIRE, INC.",Anthem Blue Cross and Blue Shield,"WellPoint, Inc.",Plan too new to be measured,Plan too new to be measured,Plan too new to be measured,Plan too new to be measured,Plan too new to be measured,Plan too new to be measured,Plan too new to be measured,Plan too new to be measured,Plan too new to be measured,Plan too new to be measured,Plan not required to report measure,Plan not required to report measure,Plan not required to report measure,Plan too new to be measured,Plan too new to be measured,Plan too new to be measured,Plan too new to be measured,Plan too new to be measured,Plan too new to be measured,Plan too new to be measured,Plan too new to be measured,Plan too new to be measured,Plan too new to be measured,Plan too new to be measured,Plan too new to be measured,Plan too new to be measured,Plan too new to be measured,Plan too new to be measured,Plan too new to be measured,Plan too new to be measured,Plan too new to be measured,Plan too new to be measured,Plan too new to be measured,Plan too new to be measured,Plan too new to be measured,Plan too new to be measured,Plan too new to be measured
H7787,Local CCP,"HEALTHSPRING LIFE & HEALTH INSURANCE COMPANY, INC.",HealthSpring Medicare Advantage PPO,CIGNA,3,3,5,4,2,4,Plan too new to be measured,Plan too new to be measured,2,5,Plan not required to report measure,Plan not required to report measure,Plan not required to report measure,Not enough data available,3,5,2,3,3,3,3,2,2,2,4,4,4,4,4,1,4,3,4,5,Not enough data available,4,2
H7811,Local CCP,ARCADIAN HEALTH PLAN,"Arcadian Health Plan, Inc.",Humana Inc.,Plan too new to be measured,Plan too new to be measured,Plan too new to be measured,Plan too new to be measured,Plan too new to be measured,Plan too new to be measured,Plan too new to be measured,Plan too new to be measured,Plan too new to be measured,Plan too new to be measured,Plan not required to report measure,Plan not required to report measure,Plan not required to report measure,Plan too new to be measured,Plan too new to be measured,Plan too new to be measured,Plan too new to be measured,Plan too new to be measured,Plan too new to be measured,Plan too new to be measured,Plan too new to be measured,Plan too new to be measured,Plan too new to be measured,Plan too new to be measured,Plan too new to be measured,Plan too new to be measured,Plan too new to be measured,Plan too new to be measured,Plan too new to be measured,Plan too new to be measured,Plan too new to be measured,Plan too new to be measured,Plan too new to be measured,Plan too new to be measured,Plan too new to be measured,Plan too new to be measured,Plan too new to be measured
H7908,Local CCP,"AETNA HEALTH, INC. (PA)",Aetna Medicare,Aetna Inc.,Plan too small to be measured,Plan too small to be measured,Plan too small to be measured,Plan too small to be measured,Plan too small to be measured,Plan too small to be measured,Plan too small to be measured,Plan too small to be measured,2,Plan too small to be measured,Plan not required to report measure,Plan not required to report measure,Plan not required to report measure,Plan too small to be measured,Plan too small to be measured,Plan too small to be measured,Plan too small to be measured,Plan too small to be measured,Plan too small to be measured,Plan too small to be measured,Not enough data available,Not enough data available,Plan too small to be measured,Plan too small to be measured,Plan too small to be measured,Plan too small to be measured,Plan too small to be measured,Plan too small to be measured,Plan too small to be measured,Not enough data available,2,Not enough data available,Not enough data available,Not enough data available,Not enough data available,5,4
H7917,Local CCP,"BLUECROSS BLUESHIELD OF TENNESSEE, INC.",BlueCross BlueShield of Tennessee,BlueCross BlueShield of Tennessee,4,3,5,5,4,5,Plan too small to be measured,Plan too small to be measured,2,4,Plan not required to report measure,Plan not required to report measure,Plan not required to report measure,1,4,4,4,4,4,4,3,3,3,4,4,3,4,2,3,3,3,3,3,4,2,3,5
H7949,Local CCP,"PACIFICARE OF NEVADA, INC.",SecureHorizons by UnitedHealthcare,"UnitedHealth Group, Inc.",4,5,5,5,3,3,Plan too new to be measured,Plan too new to be measured,2,4,Plan not required to report measure,Plan not required to report measure,Plan not required to report measure,Not enough data available,4,5,4,5,3,Not enough data available,2,1,4,2,1,1,1,1,2,1,1,4,2,3,Not enough data available,5,5
