H7908,AETNA HEALTH,,,,,,,,,,,,,,,,,,,,,,,,,,,,,
H7917,BLUE CROSS BLUE SHIELD OF TENNESSEE,,,,,,,,,,,,,,,,,,,,,,,,,,,,,
H7981,MCS LIFE INSURANCE COMPANY,,,,,,,,,,,,,,,,,,,,,,,,,,,,,
H8011,AMERICAN PROGRESSIVE,,,,,,,,,,,,,,,,,,,,,,,,,,,,,
H8031,"GATEWAY HEALTH PLAN OF OHIO, INC.",,,,,,,,,,,,,,,,,,,,,,,,,,,,,
H8189,"MANAGED HEALTH SERVICES, WISCONSIN",,,,,,,,,,,,,,,,,,,,,,,,,,,,,
H8201,METROPOLITAN HEALTH PLAN,,,,,,,,,,,,,,,,,,,,,,,,,,,,,
H8393,COVENTRY HEALTH AND LIFE INSURANCE CO. (NEBRASKA),,,,,,,,,,,,,,,,,,,,,,,,,,,,,
H8468,GEISINGER INDEMNITY INSURANCE COMPANY,,,,,,,,,,,,,,,,,,,,,,,,,,,,,
H8604,THP INSURANCE COMPANY,,,,,,,,,,,,,,,,,,,,,,,,,,,,,
H8606,PREFERRED HEALTH INC.,,,,,,,,,,,,,,,,,,,,,,,,,,,,,
H8644,HUMANA INSURANCE COMPANY,,,,,,,,,,,,,,,,,,,,,,,,,,,,,
H8649,"ALTIUS HEALTH PLANS, INC. (UTAH)",,,,,,,,,,,,,,,,,,,,,,,,,,,,,
H8707,HUMANA INSURANCE COMPANY,,,,,,,,,,,,,,,,,,,,,,,,,,,,,
H8742,"ABRI HEALTH PLAN, INC",,,,,,,,,,,,,,,,,,,,,,,,,,,,,
H8778,ESSENCE INC.,,,,,,,,,,,,,,,,,,,,,,,,,,,,,
H8836,MENNONITE MUTUAL AID ASSOCIATION,,,,,,,,,,,,,,,,,,,,,,,,,,,,,
H8991,"AMERIGROUP FLORIDA, INC.",,,,,,,,,,,,,,,,,,,,,,,,,,,,,
H9001,FALLON COMMUNITY HEALTH PLAN,86,78,91,94,80,92,71,72,96,92,14,92,87,82,82,,96,22,86,91,88,65,45,61,78,25,90,100,89
H9003,KAISER FOUNDATION HP OF THE N W,87,60,95,93,75,93,81,83,95,84,14,90,86,80,79,69,93,48,83,94,89,60,61,58,81,28,87,97,93
H9005,"GROUP HEALTH PLAN, INC.",70,63,93,82,78,90,82,79,96,,8,93,93,88,85,68,97,20,70,91,79,51,53,72,81,23,,99,86
H9011,UNITED HEALTHCARE OF FLORIDA INC.,70,44,91,90,32,90,41,48,84,,,89,,,81,44,,17,39,83,65,41,,48,68,25,,,
H9047,PROVIDENCE HEALTH PLAN,78,67,92,92,80,88,79,79,97,79,,91,91,85,80,62,94,,85,90,90,60,,58,70,28,,94,75
H9082,"MOLINA HEALTHCARE OF NEW MEXICO, INC.",,,,,,,,,,,,,,,,,,,,,,,,,,,,,
H9101,"ELDERPLAN, INC.  - SHMO",60,50,91,91,62,91,,,89,38,26,,,,,58,,15,63,91,61,39,41,50,59,36,77,66,58
H9103,KAISER FOUNDATION HP OF THE N W,86,61,96,94,78,95,,,97,,13,,,,,69,,46,85,97,91,65,78,63,87,29,95,95,73
H9104,SCAN HEALTH PLAN,73,53,90,87,72,84,,,95,33,13,,,,,78,,15,61,87,62,39,39,57,65,30,82,98,86
H9302,"PUGET SOUND HEALTH PARTNERS, INC.",,,,,,,,,,,,,,,,,,,,,,,,,,,,,
H9313,MEDICAL MUTUAL OF OHIO,,,,,,,,,,,,,,,,,,,,,,,,,,,,,
H9385,SCAN HEALTH PLAN OF ARIZONA,,,,,,,,,,,,,,,,,,,,,,,,,,,,,
H9452,"ROCKY MOUNTAIN HOSPITAL AND MEDICAL SERVICES, INC.",,,,,,,,,,,,,,,,,,,,,,,,,,,,,
H9466,"HMO MISSOURI, INC.",,,,,,,,,,,,,,,,,,,,,,,,,,,,,
H9519,INDEPENDENT HEALTH BENEFITS CORPORATION,,,,,,,,,,,,,,,,,,,,,,,,,,,,,
H9663,AETNA LIFE INSURANCE COMPANY,,,,,,,,,,,,,,,,,,,,,,,,,,,,,
H9720,"AMERICA'S 1ST CHOICE HEALTH PLANS, INC.",,,,,,,,,,,,,,,,,,,,,,,,,,,,,
H9793,"HIGHMARK, INC.",,,,,,,,,,,,,,,,,,,,,,,,,,,,,
H9859,"MVP HEALTH PLAN, INC,",,,,,,,,,,,,,,,,,,,,,,,,,,,,,
H9882,"VIRGINIA PREMIER HEALTH PLAN, INC.",,,,,,,,,,,,,,,,,,,,,,,,,,,,,
H9931,HEALTHPARTNERS INSURANCE COMPANY,,,,,,,,,,,,,,,,,,,,,,,,,,,,,
H9951,FIRSTSOLUTIONS DBA FIRST PLAN OF MINNESOTA,,,,,,,,,,,,,,,,,,,,,,,,,,,,,
H9956,"ANTHEM HEALTH PLANS OF NEW HAMPSHIRE, INC.",,,,,,,,,,,,,,,,,,,,,,,,,,,,,
R3175,UNITED HEALTHCARE INSURANCE COMPANY,,,,,,86,,,82,,,,,,,44,,,,,,,,,,,,,
R3444,CARE IMPROVEMENT PLUS SOUTH CENTRAL INSURANCE CO.,,,,,,,,,,,,,,,,,,,,,,,,,,,,,
R5287,UNITED HEALTHCARE INSURANCE COMPANY,,,,88,,91,,,96,49,,,,,,44,,,53,,,,,,65,,47,100,
R5342,UNITED HEALTHCARE INSURANCE COMPANY OF NEW YORK,,,,79,,85,69,65,89,,,89,88,78,70,44,96,,43,,,,,,,,,,
R5553,INSTIL HEALTH INSURANCE COMPANY,,,,70,,72,,,95,,,,,,,85,,,21,,,,,,,,,,
R5566,BLUE CROSS BLUE SHIELD NORTHERN PLAINS ALLIANCE,,,,53,,57,,,91,,,,,,,,,,58,81,0,0,,,,,,,
R5595,AETNA LIFE INSURANCE COMPANY,,,,,,,73,73,,,,91,91,76,60,,96,,,,,,,,,,,,
R5674,"SIERRA HEALTH AND LIFE INSURANCE COMPANY, INC.",,,,,,,,,,,,,,,,,,,,,,,,,,,,,
R5826,HUMANA INSURANCE COMPANY,69,44,85,80,53,86,61,64,94,58,15,87,86,74,60,63,94,19,40,85,3,9,38,,67,29,72,94,88
R5863,HEALTH NET LIFE INSURANCE COMPANY,,,,81,,84,,,91,,,,,,,74,,,43,,,,,,,,,,
R5941,"ANTHEM INSURANCE COMPANIES, INC.",,62,,78,40,69,,,92,,,,,,,77,,,45,79,,,,,,,,,
R6801,CARE IMPROVEMENT PLUS OF TEXAS INSURANCE COMPANY,,,,,,,,,,,,,,,,,,,,,,,,,,,,,
R9896,CARE IMPROVEMENT PLUS SOUTH CENTRAL INSURANCE CO,,,,,,,,,,,,,,,,,,,,,,,,,,,,,
R9943,BC LIFE and HEALTH INSURANCE COMPANY,,,,50,,,,,,,,,,,,63,,,46,,,,,,,,,,
